0	What was our transport doing in Albanian airspace that made the US culpable for the plane crash?	Karrde2100	politics	1	1	0	2016-09	1475259583	US Military G500 transport transiting Albanian airspace crashes, killing 20. Families of the dead raise hell, all US nationals in the area detained as witnesses and held until the US Government faces trial. Lawyers and Politicians can be creative and spiteful bottom feeders in every nation, not just in the US.
1	Man, life under Obama sure was complete hell	Curlybrac	EnoughTrumpSpam	3	-1	-1	2016-11	1479492434	"""If you vote for Hillary then you'll get 4 more years of the same crap!"" is, was, and always will be my favorite argument from a Trumpster. Like, 'oh no, are you going to bring out the *comfy chair*!?'"
0	That was just a stupid play	MidsizeGorilla	nfl	1	-1	-1	2016-10	1477847385	The most undisciplined team in the league
0	I'm confused, did they already retool their token/ad sheet to add Energy Reserve cards?	i_love_pendrell_vale	magicTCG	64	64	0	2016-09	1475249563	They exist! ENERGY!
1	SJW refuses to have honest conversation wow surprise	theborbes	politics	0	-1	-1	2016-11	1479493086	I can't believe we're having this conversation.
1	But... But I thought Trump was literally Hitler...	wishitookthebluepill	unpopularopinion	1	-1	-1	2016-11	1479595894	While Right wing opinions are on the rise again, it's still a small minority. Trump is right of center and can hardly be called a conservative, Brexit was economic which isnt really relevant to the topic and the Alt Right is a tiny internet based minority.
1	Could it be the dreaded *internalized misogyny*?	BioShock_Trigger	TumblrInAction	7	-1	-1	2016-11	1479596063	Sounds misogynistic.
1	"My guess is it stopped being taught and instead people taught ""How dare you!?"""	BioShock_Trigger	TumblrInAction	1	-1	-1	2016-10	1476345446	"What the fuck happened to *""Sticks and stones may break my bones, but words will never hurt me.""*"
0	The paper must be coated in LSD	TheSaltyFlipper	Flipping	2	2	0	2016-09	1474752331	How is this possible?
1	It wants you to update all your dang apps first.	BrownsFanZ	iphone	1	-1	-1	2016-11	1479596576	The download thing has been exactly like this for an hour. What do I do?
0	Pesky, isn't he?	DJLinFL	gunpolitics	1	-1	-1	2016-12	1480892680	In your opinion only, my friend.
1	""" I was in gymnastics at the time"" Ok cool yea that explains everything, thanks."	MustNeedDogs	thatHappened	37	-1	-1	2016-11	1479596784	Child gymnast does a flip over a white sports car speeding down the road at him
1	Sounds like Putin's private plane	Malcorgi	MapPorn	9	-1	-1	2016-11	1479597439	Sounds like a crappy airline founded in 1992, and all the planes are military cargo ones hastily converted. The Stewardess is some bruiser who's weirdly defensive of Ukraine, and while the food is shite there is a TON of vodka.
0	High quality bonds don't always give attractive returns, but they are still an attractive diversifier that brings stability to a portfolio.	herpington	personalfinance	32	32	0	2016-09	1473198837	I'm not scared of the word bond. Quite the opposite, not enough risk for long term growth.
0	Did you read the manga?	alsotri	Monstercat	1	-1	-1	2016-10	1475332454	Damn im like 5 episodes before is it that good?
0	This is the only correct answer.	climberslacker	ems	4	-1	-1	2016-11	1479598909	Yes. Learn the actual pathophysiology behind it. pH of blood is determined by the amount of retained C02 held within the blood as bicarbonate. (H+ &amp; HCO3). Specifically those H+ ions determine the pH. Lots of H+ ions, = acidic. Too few = alkaline. So, if your patient hyperventilates, they blow off all of thier carbon dioxide. They lose H+ ions. They go into respiratory alkalosis. If your patient fails to do much of the breathing thing at all, poor tidal volume, dodgy exchange, they will fail to get rid of enough C02. The H+ ions will build up. They'll become acidotic.
0	Absolutely no worries, I tend to write on the assumption that people are telepathic.	TheTweets	ffxiv	1	-1	-1	2016-10	1476462581	Aha! Yes, I did misunderstand you. Sorry! My fault.
0	How good is your coach?	im_not_not_white	NBA2k	1	-1	-1	2016-11	1480032378	Why is it that I can't convince the game my team sucks? Trying to tank in GM mode. Terrible players have high minutes. Hard set rotations. I sim a game and it has me beating the cavs by 30. My team is designed to be 2014 sixers level because my two stars both tore up their knees. I don't get why the sims seem to win me games I've no business sticking around in. And conversly, I lose to the sixers and nets when I sim with my teams that have been crafted for stardom. I don't get this. Is there some switch to flip to make it realize what's going on?
0	"Or ""Dat Toyoda der made shure Daniel won the championship"" on Facebook"	joerut00000	NASCAR	4	-1	-1	2016-11	1479599953	"It was the crew chief's call to have the 14 stay out. There's no reason to demonize Cole Whitt for this. Conspiracy time!!! (Just for fun, guys). NASCAR ""encouraged"" the 14 to stay out to create drama. OR. To make sure that the first international driver wins a NASCAR championship....."
0	Boardwalk Empire	coolroth	The_Donald	8	-1	-1	2016-11	1479600187	Iceman probably. He was ok in that series where he played the FBI prohibition investigator.
0	I noticed the medical droid I put down in a previous life was still healing my teammates and giving me points even though I switched loadouts as well!	Gen_Fredburger	StarWarsBattlefront	3	3	0	2016-09	1474742646	PSA: Your trip mine stays active if you switch loadouts Apologies if this is old news, but I figured it out last night and was too fired up not to share. Playing cargo on Rebel Depot in my defensive* loadout, which includes the trip mine: I had placed a trip mine at one of the side entrances to our base a while back, died, switched to my chase carriers/run the cargo loadout which does *not* include the trip mine. A minute later I get a notification that my previous trip mine took someone out. So trip mines stay active, even if you switch to a loadout that doesn't have the trip mine in it. I fully expected my mine to disappear when I spawned in with the other loadout. It effectively gives you 3 star cards for a limited time. *The ability to have a different trait with each loadout is worthy of its own strategy discussion thread, IMHO. TLDR: trip mines stay active until tripped or you place another mine
0	Never claimed it was illegal, just ridiculous.	umkvec	atheism	2	-1	-1	2016-11	1479600610	Their money, the sky is a public space. I think. It's FAA controlled, but I don't think that falls into tax sponsored expression of religion. The good news is, it's a temporary thing. Dust in the wind.
0	Yeah I'll probably end up taking it to Goodwill	bladeeeeee	streetwear	1	-1	-1	2016-11	1479601088	Sheesh! You're a savage bro!
1	If you had just communicated you could have told them that earlier!	ncfc86	fatlogic	3	-1	-1	2016-11	1479601512	Oh please. The corporate world is full of crazy consultants. We just had like a corporate culture forensic analyst spend three months in our office to come to the conclusion that we don't communicate
1	Yeah those 4 million votes for johnson would have helped shillary win	ma70jake	ThanksObama	1	-1	-1	2016-11	1479601609	So, you're the reason we now have Trump.
0	Go go gadget gonorrhoea	zyxwa2000	ofcoursethatsathing	1	1	0	2016-09	1472968296	How does go gonorrhoea compare to regular gonorrhoea ?
0	am i in the wrong if i prefer the jackets to lose so they don't one up our streak?	Senyavin	Flyers	6	-1	-1	2016-12	1482452506	Guys how do we look? I lost a bet to my penguins fan friend and am currently watching this fucking Columbus game. Crosby scored already on some bitch ass tip in that looked like he did it on accident.
1	Reality has a liberal bias.	quadrophenia515	The_Donald	2	-1	-1	2016-11	1479677568	Isn't it odd that NYT's top shareholder donates to Clinton Foundation and somehow the paper ends up as the most anti-Trump paper published? Must be a coincidence, right?
1	Not One-Tag 5/7	belkak210	paradoxplaza	0	-1	-1	2016-11	1479677645	Thought Paradox would enjoy this
0	Dark blond hair, red beard... fml	Orsonius	todayilearned	1	1	0	2016-09	1473282717	TIL that some non-redheaded men have red beards because they have one copy of the MC1R gene. Two copies would make them fully redheads
0	Handing in my essay #mad #legend #HEDIDTHAT	Sakisaka	madlads	5	5	0	2016-09	1475079152	WHERE IS HE??!?!?
0	There is no *rule* to have exceptions to, because karma does not exist.	Prosthetic_Foreskin	AskReddit	0	-1	-1	2016-11	1479680767	These people are the exception, not the rule. You need to have some pretty intense social pull, like a lot of money or a kick-ass house, to be a constant asshole and still have people fawn over you.
0	1266 mhz core clock compared to the 1306-1342 core clock on boost mode	explainFeels	pcmasterrace	1	-1	-1	2016-11	1479681220	what's the quiet mode?
0	TSM Fans	MegamanEXE79	leagueoflegends	-11	-11	0	2016-09	1473633419	I always wonder, how can people state facts based on pure imagination...
0	It makes it less gold efficient but evens out with the amount of magic damage Kog'Maw deals himself.	Devastration	leagueoflegends	1	1	0	2016-09	1473538222	Yeah, Full AD team, better rush Wits End! :P Imo Botrk is also a really good first item.
0	Are we starting the Bray Wyatt Wrestlemania championship circle jerk early this year?	SpiffHimself	SquaredCircle	3	-1	-1	2016-11	1479681694	"How WWE Should Book Survivor Series 2016 **Hey everyone! Every month, days before PPV's happen, I share my thoughts on the show and card and how I would book the show that has unexpected swerves, returns, debuts, and a memorable show that would leave fans happy. If you want, you can read some past editions of these by clicking on my name and searching. I have been doing these for every PPV since Night Of Champions 2015. I hope you enjoy, and this is how Survivor Series 2016 Should Be Booked.** **PRE SHOW** * Oh... oh god... it's 2 hours... We get the usual panel of Renee, Booker, Lita, and Jerry Lawler. Two Social Media Lounge segments are announced earlier in the day with Kalisto and Sami Zayn. There actually haven't been any Pre show matches announced as of yet, so we can use our IMAGINATION and make some up! We get to our first one. **1ST KICKOFF MATCH: Bo Dallas vs Curtis Axel** * At least this has a tiny bit of background behind it. Bo and Axel still have unfinished business after their mini feud a few weeks ago. Bo is out first followed by Axel. The match goes 8 minutes and Axel gets his win back after pinning Bo with a Perfect-Plex. **WINNER: Curtis Axel** * We get the SML with Kalisto and then the panel talks some more and give predictions and we get video packages and all that good stuff. We get to our 2nd kickoff match. **2ND KICKOFF MATCH: TJ Perkins, Neville, Cedric Alexander &amp; Rich Swann vs Ariya Daivari, Gran Metalik, Drew Gulak, &amp; Tony Nese** * 8 man tag. Neville should be part of the CW division. The heels are out first followed by the face Team. The match goes 14 minutes, and the faces win after Neville hits a Red Arrow onto Daivari's legs and then tags in TJ to locks in the kneebar on his injured knee. **WINNERS: TJ Perkins, Neville, Cedric Alexander and Rich Swann** * We get the Sami Zayn SML and then we get the panel's final predictions and thoughts, and we get to Survivor Series. **MAIN SHOW** * We get the opening video package and pyro as Michael Cole welcomes us to the 30th annual Survivor Series. Like Summerslam, the RAW team will call RAW matches, the SD team will call SD matches, and for dual brand matches, like the one that's kicking off, both teams will talk. **1ST MATCH: New Day, The Club, Cesaro &amp; Sheamus, Enzo &amp; Cass and the Shining Stars (TEAM RAW) vs Heath Slater &amp; Rhyno, Hype Bros, Breezango, The Usos and American Alpha (TEAM SD)** * New Day is out first and they have all sorts of canaidian stereotypes, as Big E tosses out Maple Syrup to the crowd, and Kofi has a canaidian flag, and Woods is wearing a Maple Leafs jersey playing a special red and white trombone. Their gear is red and white also. Slater/Rhyno out next, followed by Enzo and Cass, then Breezango, then The Shining Stars, then Hype Bros, The Club, Usos, Cesaro and Sheamus, and finally American Alpha. The match goes 28 minutes (SS matches are always really long, calm down). The champs on both respective brands start it off. The Hype Bros are eliminated first after the Club hits a magic killer. Next, The Usos eliminate Sheamus/Cesaro after arguing. New Day eliminate Breezango. Shining Stars eliminate Usos. It looks like RAW is killing SD, but SD make a comeback. AA eliminate Shining Stars and Enzo/Cass. Slater/Rhyno eliminate Club. New Day are the last RAW team left, and for SD it's down to AA and the champs. Woods has some shenanigans with the trombone on the outside and throws it at Slater and then Big E eliminates the SD Tag champs with a Midnight Hour. The lone survivors on either team are New Day and American Alpha. The crowd is electric and Jason Jordan and Big E are the legal men. They lock up and they fight for 2-3 more minutes. The ref is distracted by Xaivier as he thinks he's trying to help Big E, but suddenly two men in hoods come from under the ring. They lay out Kofi and Xaivier and then run to the back. It would be revealed the next night on Raw that the masked men would be the debuting Revival, and in the main event they would defeat New Day for the titles. Revival would say they don't care about Brand Supremecy, and they damn sure didn't do it to help their formal rivals American Alpha. They wanted to make a name and deception overcame New Day to give the TOP GUYS a title shot, that they knew with !00% certainty they would win. Alpha hit Grand Amplitude on Big E and AMERICAN ALPHA are now instantly over to the spot they deserve and they look impressive. Alpha would say on SD that they didn't like the way they won, but they knew they would for SD. American Alpha are the lone survivors, and would challenge for the Tag Titles against Slater/Rhyno at TLC in a Chairs match. I'll have the match card for TLC at the end of this post. **WINNERS: TEAM SD** *LONE SURVIVORS: AMERICAN ALPHA* * We get an ad for WWE Shop. **2ND MATCH: Brian Kendrick (c) vs Kalisto (Cruiserweight Championship; if Kalisto wins, the CW's move to SDLIVE)** * Kendrick is out first followed by Kalisto. The match goes 13 minutes. I hate to be having so many title changes in such a short amount of time, but it's obvious that Kalisto will and should win here because 205Live is right after SD. Plus, Kalisto was US Champ at the beginning of the year, so he has credibility, and he's really good. The match ends when Kendrick locks in the Captain's Hook, but Kalisto leans against Kendrick and makes his way to his feet, still holding on to Kendrick's head, and then runs off the ropes and hits a Salida Del Sol for the win and title. **WINNER and NEW CRUISERWEIGHT CHAMPION: Kalisto** * We get a backstage interview with American Alpha about being the lone survivors and winning for SD. **3RD MATCH: Charlotte Flair, Sasha Banks, Bayley, Nia Jax &amp; Alicia Fox (Team Raw) vs Becky Lynch, Alexa Bliss, Naomi, Carmella, &amp; Nikki Bella w/ Natlaya (TEAM SD)** * Bayley is out first followed by Becky Lynch, Nia Jax, Carmella, Alicia Fox, Alexa Bliss, Sasha, Naomi, Charlotte, and finally captain Nikki Bella with coach Natalya. The match goes 22 minutes. Sasha and Alexa start things off. Nia Jax eventually gets in and plows through everyone and eliminates Naomi and Carmella to get Raw a good start. Becky locks in the Disarmer on Alicia to tap her out and eliminate her. Bayley hits a Bayley to Belly through the SD announce desk to eliminate Alexa. I love Alexa the most out of anyone on this team, but Becky and Nikki should be the final two on SD. At least it's a big way to send her out. Sasha hits a Backstabber into a Bank Statement to tap out Nikki, and Nikki goes to the back and shes about to do the same to Becky but all of a sudden Charlotte runs in and throws Sasha out of the ring. She just wants to be a dick heel. She wants the pin for herself. The glory for herself. She throws out Banks and runs off the ropes and hits a spear to Becky to win the Women's match for Team Raw. It's 1-1. **WINNERS: TEAM RAW** *Lone Survivors: Charlotte Flair, Sasha Banks, Nia Jax &amp; Bayley* * We get an ad for TLC. **4TH MATCH: Kevin Owens, Chris Jericho, Seth Rollins, Braun Strowman &amp; Roman Reigns (TEAM RAW) vs AJ Styles, Dean Ambrose, Bray Wyatt, Randy Orton &amp; Shane McMahon w/ James Ellsworth (TEAM SD)** * I'M #TEAMBRAUN. Owens is out first followed by Bray Wyatt &amp; Randy Orton, then Chris Jericho, Shane McMahon, Roman Reigns, Dean Ambrose and James Ellsworth, Braun Strowman, AJ Styles, and finally Seth Rollins. The match goes 35 minutes, and has lots of first time interactions that everyone will jizz over and lots of big spots and moves. Rollins and Reigns argue over who will start the match and Ambrose walks up to them for a huge pop for another mini Shield Reunion. Ambrose gives them both a jumping Dirty Deeds. Ambrose throws Reigns out and Rollins and Ambrose start the match. Orton eliminates Roman after Roman hits Orton with a Superman Punch, and then runs off the ropes to hit a spear but Orton catches him Midair with an RKO. Shane hits Jericho with a Coast to Coast with a trashcan to eliminate Y2J. Bray and Strowman are the legal men at one point and they have a staredown. Suddenly, Luke Harper runs in from behind and Orton RKOs the ref and Harper and Bray beat down Strowman with steel chairs. Wyatt hits a Sister Abigail to eliminate Strowman. It's not looking good for RAW. Strowman gets offered to be helped out by trainer but he pushes them all down. As Strowman is walking to the ramp, Ellsworth runs up and extends his hand to a HUGE pop. The man that started it all for the Chinless Wonder. Strowman looks pissed and Ellsworth realizes what hes done. James tries to run but Strowman catches him and MURDERS him by giving him a Running Powerslam through the barricade. Owens starts to make a comeback as Rollins is laid out on the outside and he gets RKO'ed by Orton. Rollins runs in to try to help but he eats a Styles Clash from AJ. It's 1-5. Kevin Owens is the last member of Team Raw to a full Team SD. Owens has the ""Yeah I'm fucked"" look on his face. Styles hits a Pele Kick on Owens as he turns around. Owens is down now and Styles goes to the apron to set up the Forearm. Owens is up and Styles is about to jump but Bray Wyatt runs in and hits a Sister Abigail to pin Owens and win for Team SD. Wyatt celebrates as AJ is still on the apron and looks stunned. Styles goes in the ring and pushes Wyatt. Wyatt and Styles have words and Styles says that that was his pin. Styles slaps Bray and Bray laughs. Wyatt hits a Sister Abigail on Styles and then holds up the WWE World Title to a huge pop. Styles is laid out and Wyatt drops the title over Styles then walks out. Another Wrestlemania storyline has just begun. **WINNER: TEAM SD** *LONE SURVIVORS: Clean Sweep* * We get an ad for the network and Wrestlemania. **5TH MATCH: The Miz (c) vs Sami Zayn (Intercontinental Championship)** * Sami is out first followed by Miz. I really don't get why they had Ziggler lose the title last week. Sami is just gonna win it here. Maybe they wanted to keep Ziggler looking strong for something. The match goes 16 minutes and Zayn wins the title after he hits a Helluva kick. But then he wants to really send a statement. He puts Miz back in the corner for a second Helluva kick. 1. 2. 3. Sami Zayn is finally champ. Zayn is interviewed after the match by Byron Saxton and there is confetti everywhere. Zayn talks about what he went through to get to this point. He says he think he would be treated better on SD, and disses Mick and Stephanie, and says the IC Title is STAYING on SD, because he's GOING to SD! **WINNER and NEW IC CHAMP: Sami godamn Zayn** **6TH MATCH: Brock Lesnar w/ Paul Heyman vs Goldberg** * This match will be very interesting. The crowd reaction and how Goldberg does, as he's 49, hasn't wrestled in 12 years, and tweaked his shoulder on RAW. We get a video package before the match and Lesnar is out first followed by Goldberg. All main roster and NXT talent are there and we see DIY doing their Glorious Bomb during the entrance with their newly won NXT Tag Titles as they promised. The match goes 11 minutes, because there's no way Goldberg can do a really long match. At first, as a rib to the fans, they lock up once for a few seconds, then break it then lock up again, as a flashback to what their WM20 match was. They try to lock up one more time but Lesnar gets Goldberg up on his shoulders and hits an F-5, and Goldberg just barely kicks out. Hopefully it's much better than expected and exceed's everyone's expectations. In one spot, Goldberg spears Lesnar into the ring post. The big spot in the match is when Goldberg nails Lesnar with a Jackhammer through the RAW table. Lesnar works over Goldberg's arm the whole match and at one point he powerbombs Goldberg onto the apron and Goldberg's arm lands on the edge. The match ends when Lesnar locks in the Kimura Lock on Goldberg and in kayfabe breaks his arm, and Goldberg taps out. Lesnar hasn't won with the Kimura Lock in a while, and it would tell a good story here. After the match Goldberg is put in a Splint and stretchered out. Lesnar is celebrating and poses on the middle rope as pyro goes off. Lesnar has won the mega match. The camera is focused on Lesnar as he gets down and we hear the crowd erupt. All of a sudden, Samoa Joe runs and nails Lesnar with his newly won NXT Title. Just because Joe won back the title doesn't mean he can't be on the main roster, as many superstars have done the same, and he's no doubt losing it back to Nakamura at the show in Osaka, Japan in December. Heyman screams at Joe but then Heyman tries to apologize and says his ""I;m just an advocate"" line and Joe grabs him by the collar and hurls him over the ropes. Joe nails Lesnar with a Muscle Buster and then locks in the Coquina Clutch and won't break it even after all the trainers and refs in the locker room spill out to try to stop him. Joe finally breaks it. We have another Wrestlemania storyline begun. **WINNER: Brock Lesnar** *TLC CARD (SDLIVE)* * WWE World Title: AJ Styles (c) vs Dean Ambrose (TLC) * IC Title: Sami Zayn (c) vs The Miz vs Bray Wyatt vs Dolph Ziggler (Tables) * SD Tag Titles: Slater/Rhyno (c) vs American Alpha (Chairs) * SD Women's Title: Becky Lynch (c) vs Alexa Bliss (Ladder) * Kane vs Luke Harper * Carmella and Natalya vs Nikki Bella and Naomi * Pre Show: Baron Corbin vs Kalisto (No.1 Contendership to IC Title) I'll have my card for the Royal Rumble for both brands on my How WWE Should Book TLC 2016 post. I hope you all enjoyed! This was a longer one. Tell me what you liked or didn't like and what on here you'd like to see happen on the show! Enjoy Survivor Series everybody!"
0	Thank god	Caves_Caves	nfl	1	-1	-1	2016-12	1482812911	Tyron good y'all
0	did you miss the sunny days where it was like 25 degrees for the last two months or something	nononoitsfine	VictoriaBC	63	63	0	2016-09	1472831104	To whom do I complain About our non-summer? Is it just me, or did we not get one this year? Yesterday's high: 15.3C. I've lived here since 2003 and this is the second time there's been a non-summer - more of an extended spring turning into fall - so I'm not sure this is climate change-related. Still, it seems like fall/winter has started already....
1	Beauty is in the eye of the beholder	Ace-in-a-Day	pics	-10	-1	-1	2016-11	1479693297	The deep dark truthful mirror, by Mr. Fish
1	If they did win, it'd be an even bigger loss wouldn't it be?	bubbavic	Chargers	2	-1	-1	2016-11	1479693559	I don't think the Broncos can win this week?
1	Yea, I'm pretty sure he forgot this	FappinSpree	politics	2	-1	-1	2016-11	1479694209	You can't be serious.
0	Maybe your scale is broken?	blauschein	AdviceAnimals	5	-1	-1	2016-11	1480043146	Ashamed to admit how far I had to come to get to this point, but I'll take it.
0	As opposed to the hordes of triggered SJWs commenting here?	blauschein	pics	1	-1	-1	2016-12	1480736265	A lot of triggered conservatives commenting in here.
0	I'm gonna be honest with you, I doubt there's any cognizant relation to that particular film... I don't know if you've seen it, but it's pretty low budge and ultimately not great fam	troubladour	AmericanHorrorStory	-4	-1	-1	2016-11	1479694636	"""Dead Bird"" ~ Graffiti seen behind Flora in the finale - I think I found something! I decided to Google ""Dead Bird"" because the phrase seems important. I discovered there was a movie released in 2004 called Dead Birds. The movie followed a group of Confederate soldiers (the Polks had a Confederate flag) who took refuge in an abandoned plantation. They soon discovered the home was haunted by spirits. In the end, everyone dies. Some interesting points include a character who was a nurse and a spirit who shows another character what happened to create the events that surround the house. The demons in the movie resemble Edward Mott's face as the torch crossed over him."
1	Fucking russian bias...	Valkyrie429	pcmasterrace	2	-1	-1	2016-11	1479695334	Warthunder on ps4 supports it
1	Careful, those things enlarge and can devour entire body parts.	enorage	washingtondc	2	-1	-1	2016-11	1479695350	Washington, WTF is in my shower?
0	What if I say it in a sexy way, do I die surrounded by attractive women?	i8plumcake	AskReddit	1	1	0	2016-09	1473880751	Then you will die quietly and nobody will even know you're gone.
