1	Yes, I'd rather spend my time posting on reddit than actually playing R6 or some other game right now.	ellekz	Rainbow6	-2	-1	-1	2016-11	1478984020	The victory animations are fine, people are just looking for a reason to complain.
0	Happened to me as well never bothered to find a fix for it though	WingsOfDespair	masseffect	2	-1	-1	2016-11	1478984131	"Advanced Training Bug with Haestrom (mild ME2 spoilers) I have done a few playthroughs of Mass Effect 2, and recently I decided to use Stasis on the Haestrom mission to deal with the annoying Geth drones quickly. In the process, I discovered that using Advanced Training before landing on Haestrom leads to a weird bug in the PC interface. The bonus power shifts to the #8 power spot, and the ""Unity"" and ammo power slots no longer get shaded red when they are unneeded/in use. I tried this again with Energy Drain and with a different playthrough, and it happened both times. The problem was fixable by removing all items from power slots and adding them back from the bottom toolbar. Is this something that has happened to anyone else, or is this a unique bug?"
0	Well that took a unexpected turn...	MWiatrak2077	AskReddit	2	2	0	2016-09	1474062179	Biking, swimming, starvation, drugs, and house fires are just a few off the top of my head.
0	Holy shit, a U.P guy.	MWiatrak2077	tattoos	1	1	0	2016-09	1475193897	Anyone else on Reddit from around Gogebic?
0	Zone 7b	OnceUponAHive	whatsthisplant	1	-1	-1	2016-11	1478985106	Mystery plant
1	He's been such a conventional candidate so far that this is totally shocking	ambivalentbystander	politics	2	-1	-1	2016-11	1478986066	In Unprecedented Move, Trump Ditches Press on First Visit to DC as President-Elect. Breaking decades of traditional press protocol and setting a frightening precedent for coverage of his administration.
0	The problem is in seeing *blowing things up* as the optimal solution.	sagan_drinks_cosmos	politics	3	3	0	2016-09	1474908083	They didn't blow up the city, they blew up the financial institutions.
0	This is going to be on highlight reels for years to come...	faelun	leafs	1	-1	-1	2016-12	1482262455	Matthews scores his 15th with the one handed deflection
1	This thread is mostly women encountering psychos, I'm a little worried about you	say-something-nice	AskReddit	3	-1	-1	2016-11	1478987898	Reading these comments has given me some tips on what not to do. I have caught myself doing a few of these things and i honestly did not know they were a problem. I guess i will be changing my behavior now.
0	Like as soon as Specter got nerfed so did Badman, Shame he was a beast on her.	Rysaxx	DotA2	3	3	0	2016-09	1474657466	I don't remember He was either a candidate to 8k or to 9k, one of the two but then he got to like x900 and started going down and down
0	I only flame the retards so you know 4/5ths of my team...	Rysaxx	DotA2	-2	-1	-1	2016-10	1477580369	same here. I flame often, don't climb mmr and I am not even mad. Trash talking is like a culture to me.
0	Thank you plenty, I'll keep everyone here updated good or bad :)	WastelandsWanderer	Salvia	1	-1	-1	2016-10	1477675540	I like the plan. You sound like you've thought this out. I sincerely wish you the best and am very interested in hearing the progress :)
1	He's not a white male, so it's not his fault.	aehlemn1	politics	6	-1	-1	2016-11	1478990200	Tell me this: why hasn't Obama addressed the hate crimes that have occurred during the election race? Further, why has he not seriously addressed incredible rise of racism that has occurred during his tenure as president? He is still the president. He still can. But he won't.
1	Between his real estate empire and casino brands, you're probably right	antsugi	pics	1	-1	-1	2016-11	1478991510	Trump will be an armchair president, delegating responsibility to those around him while he is busy feeding his ego. He is what is known as a useful idiot.
0	When my Redguard friends are smoking like a CHIMney this tells much about the realm of aetherius	Etehn	TrueSTL	9	-1	-1	2016-11	1478992834	CHIM is just gettin baked yo
0	Even if that were true, do you really think a poacher who is as clinical as Bacca wouldn't manage to score plenty with the chances created by the likes of Ozil, Cazorla and now Xhaka?	iforgotmyun	Gunners	2	2	0	2016-09	1473479713	He's awful, I agree with you. Overrated one-trick poacher.
0	Pretty sure a script kiddie is someone who uses rocket jump scripts and shit lol this is just a shitty hacker	Groadee	tf2	-32	-32	0	2016-09	1474896216	I play MvM to GET AWAY from people like you...
0	you can never be sure on tumblr	passion_killer	TumblrInAction	2	-1	-1	2016-11	1479708013	lol she's asian
1	Well, in 10 years his job will be automated, so...problem solved...	dblthnk	LateStageCapitalism	3	-1	-1	2016-11	1478993298	Amazon delivery drivers 'feel compelled to defecate in vans' to save time
0	I'd bet he's mad about how long it took to get the final out of the inning or maybe about how he's pitching.	parttimehuman2	gifs	1	-1	-1	2016-11	1480107680	It was cool up until the slammed the ball down..... wtf was that about?
1	197m says at the bottom	scaper28	2007scape	1	-1	-1	2016-11	1478994647	how many coins roughly?
1	why dont you trust me?	scaper28	2007scape	1	-1	-1	2016-10	1477075359	It's absolutely retarded. Why would anyone circumvent the whole purpose the dual-trade windows are in place for?
0	"Also we all know about the truthfulness of the ""scientific consensus of global warming""."	yellowsnow2	conspiracy	0	-1	-1	2016-12	1481733456	Has Trump's team denied this? Do you think the rank and file bureaucrats at the DOE made this up?
0	Do you ever wonder what its like to get a post removed?	Big_Booty_Pics	GlobalOffensive	1	1	0	2016-09	1473618663	Easy money
0	Sounds like you need Ja	Arcanine26	CFB	3	-1	-1	2016-10	1476829469	Somebody Make Sense of Auburn for me! Who is this team? The team that at the start of the year we all expected to suck, and now they are one of the most efficient offenses in the SEC and a top 5 defense in the SEC as well?! And a 9+ pt favorite over Arkansas this week? We all knew they were talented, but how did this happen so fast?
0	Was a Wii U portable?	SmasherTom	NintendoNX	1	1	0	2016-09	1473976238	This is called a Wii U.
1	Your totally right, she should have been mentioned that it is the GNU/Linux kernel that handles all the system calls.	setibeings	linux	10	-1	-1	2016-11	1478996208	Minor point, but important: these cartoons refer to the kernel as the whole OS. It's not. The whole operating system consists of everything beyond just the kernel. But the drawings only talk about just the things the kernel does.
0	I was waiting a good 10 seconds for it to load completely until I realized.	carefulcomputation	BlackPeopleTwitter	11	-1	-1	2016-11	1478996446	Didn't know they added the new jpg-the-fuck-out-of-your-photos filter.
0	This would have been really useful in GTA games to complete all the taxi/vigilante side quests.	Negative_Nil	mildlyinteresting	4	-1	-1	2016-11	1478996562	"""Choose Your Ride"" Public Service Announcement"
1	The irony, a Dillon fan talking about being ahead	ItsDennyTime11	NASCAR	6	-1	-1	2016-11	1478997530	Getting a little ahead of ourselves, aren't we?
1	How can I hate it for my guys when my guys aren't even here now ?	ItsDennyTime11	NASCAR	10	-1	-1	2016-12	1481766902	Caption this @Chaseelliott photoshoot!
0	Do both, the anime and Manga share similar story but the way it plays out is different.	Quickdawn	dbz	2	-1	-1	2016-11	1479083882	Should I read Super or watch Super? I've always enjoyed reading dragon ball more than watching it? Is the manga for Super any good? Does it stay up to date with what's in the show?
1	I for one long for the days when bigots had editorial standards!	WallofMath	OSU	5	-1	-1	2016-11	1478998806	Yeah, good point. What a shame they didn't do a better job making their horribly racist poster.
0	Well Mark Cuban is going to be on the list for sure.	dazed_and_jaded	politics	0	-1	-1	2016-11	1480272341	The race for the 2020 Democratic presidential nomination is now open
0	I wish I was creative enough for this stuff :(	wolfydude12	PlanetCoaster	1	-1	-1	2016-11	1478999696	I wasn't sold on the sci-fi set until I started actually building with it...
0	Can confirm, have FX-6350 and am delusional.	Chocobubba	overclocking	12	-1	-1	2016-12	1481061106	Could be worse, you could be delusional about an FX CPU instead. :)
0	There's already a word for lightish red and its called pink.	From_Beyonder	comicbooks	1	-1	-1	2016-12	1480828098	"""It's not pink, It's lightish red!"""
0	I never said I was the loud person and I am not the loud person.	MeowMagafe	AskReddit	1	-1	-1	2016-10	1475534702	So you are the loud person the rest dont like. Got it.
1	$47	unsupported	Gunsforsale	2	-1	-1	2016-11	1479001313	$46
0	More like Lance Reddick, dude is so underrated.	SpectralEntity	movies	7	-1	-1	2016-10	1475980670	How does nobody realise it's actually Mike Tyson
0	Didn't defend it, I'm explaining why people are prone to seeing it as harmless when it's just as sleazy.	phailhaus	funny	0	0	0	2016-09	1475255588	Nah, its sexist, quit trying to defend someone being sexist.
0	Find a insurance broker to get the best quotes in auto/home insurance.	140414	PersonalFinanceCanada	3	-1	-1	2016-10	1476410482	Switched to Videotron for mobile and Tangerine for banking. What else can I save on? Thanks to advice from PersonalFinanceCanada, as well as some friends, I've switched my bank account from TD to Tangerine and now am paying no fees. I've also just ditched Bell for mobile and signed up with Videotron (I'm in Ottawa) and I am paying almost half ($50 per month for unlimited Canada and US calling). What else does everyone recommend saving on? It feels so good to break off from these huge companies and all of their ridiculous fees. Maybe alternatives to car insurance? Looking forward to everyone's life hacks :)
0	What's your rationale for blocking reposters?	xoiz	quityourbullshit	1	1	0	2016-09	1472868497	Well considering that isn't actually a sub, then maybe yes? And this is a good thing. My +block list gets a little more complete from this sub every day.
0	Of course not, because if that plane crashes and Trump dies, *Pence* will be our leader	PVP_playerPro	worldnews	6	-1	-1	2016-12	1481509072	So you want the POTUS to fly around in planes that they have a hard time finding spare parts for and has been in operation since 1986?
0	The voice actor with the scratchy sounding voice also did some work on star wars battlefront 2 as rebel scum	Cavs032	EmpireDidNothingWrong	2	-1	-1	2016-11	1479004705	Rebels encounter TIE Interceptors for the first time
0	Really, how do you know?	theunknownandrew	funny	2	-1	-1	2016-12	1481440166	Username checks out
1	Racist	duffmannn	westworld	-5	-1	-1	2016-11	1479005797	he is black though lol. But he also looks like Santa Claus too. But Santa isn't black.
1	Please tell me this was	Corynthianleather	Jokes	3	-1	-1	2016-11	1479005983	There is no way he will get reelected if he doesn't release his tax returns. People are not that fucking stupid.
1	"""And I'll have it with Coke, can't stand the taste by itself."""	Wellwhatevericanget	mildlyinteresting	19	-1	-1	2016-11	1479006788	This Orlando, FL bar had a $15000 bottle of Bacardi for sale...and someone bought it.
0	I sort of like it but the ink is making me feel like I just spent the afternoon doing whip its under the bridge by the river.	vockins	NewYorkIslanders	2	-1	-1	2016-10	1476671111	I don't like to complain about free stuff, but wow are these T shirts hideous
0	has it been approx 4 weeks?	JaquesMehoff	GooglePixel	1	-1	-1	2016-10	1477072041	Be nice if they would send us the Promo Code
0	I question the people who aren't negative after these games...	deadnova	CalgaryFlames	2	-1	-1	2016-11	1479010896	I know it looks like a dumpster fire. But the negativity in this sub is out of control. Come on guys.
0	So vitamin K2 is a drug now?	jasnooo	Supplements	0	-1	-1	2016-10	1477589044	If a supplement actually boosted your T levels it would be a drug and regulated by the FDA.
0	Gee can't imagine why	masterjmp	KansasCityChiefs	1	-1	-1	2016-11	1480298248	They haven't thrown at Peters yet
0	Search Android Lollipop Status Bar for Anemone in Cydia.	ajkeene99	iOSthemes	3	-1	-1	2016-11	1479008995	Android L/ M status bar theme for Anemone? Thanks!
1	How I love this Russian prick interfering in our country and our elections.	Caveat-Emperor	politics	2	-1	-1	2016-11	1479009831	Putin aide: Trump could build confidence with NATO pullback
0	Well if your choices were a doctor that never went to medical school and a doctor that has been to medical school but fucks up everything they ever touch... it's not such an easy choice anymore.	bitrollar	AskReddit	8	8	0	2016-09	1474973262	If you had cancer would you go to a doctor who never went to medical school? No? Then why would you vote for the most important political position in the world for someone who has never been in politics. Especially a schmuck like Trump?
0	Yeah but at least we have that Dan Shaughnessy dumbass who wrote that the Pats brought deflategate upon themselves.	drfoqui	Patriots	3	-1	-1	2016-10	1476299726	True. Every sports team does have their Jerry Thorton commentator... now imagine if every commentator was Jerry Thorton and you have Baltimore.
0	I knew it!	johnnyredleg	gaming	2	2	0	2016-09	1473414910	I am reinstalling Fallout just for this mod alone.
0	TOI being TOI.	damnthisplanet	india	2	-1	-1	2016-11	1479969975	TOI being TOI blames Demonetization instead of Dowry
0	OP's card levels	DamnItNite	ClashRoyale	1	-1	-1	2016-11	1479010971	Where?
0	We are part of the problem	asteroid_miner	canada	4	-1	-1	2016-12	1482534125	I just wanna live and not have more taxes when this country isn't the problem
0	Sauce.	primetimey	hockey	9	-1	-1	2016-12	1482602320	Jamie Benn with the saucy saucer pass to Esa Lindell for the OT winner
0	Its live for Xbox as well	dandan-97	CoDCompetitive	12	-1	-1	2016-10	1476985815	Weekend 2 of the Beta now live for PS4. Sorry XB1
0	20,000 votes, so 5,000 people?	ronarchy	BigBrother	1	-1	-1	2016-12	1480644445	20,000 Julie said.
0	now im said again	EzlotheMinish	AFL	3	-1	-1	2016-10	1476928803	yes yes it is
0	Your writing has gotten better bud!	hockeyrugby	Habs	2	-1	-1	2016-12	1480623110	What are this year's Montreal Canadiens?
0	this gun fits my hands perfectly, but I hate the european styly mag release	CLINT-THE-GREAT	gundeals	1	-1	-1	2016-11	1479026218	Walther PK380 .380 - $299
1	Yes, because 90%+ voter participation is so undemocratic.	Internetzhero	australia	3	-1	-1	2016-11	1479017057	"Australia: ""We're undemocratic and we like it!"""
0	Ouch.	CurbedEnthusiasm	brisbane	2	-1	-1	2016-11	1480156097	We pay $240/month for 25gb of wireless broadband through optus. We're in an area that we can't get ADSL yet.
0	Poor fella just wanted to see how his brother was doing.	CoolGuySean	Overwatch	14	-1	-1	2016-11	1480469729	I DID IT REDDIT!!
1	Did somebody tell them that Clinton lost the election?	PlanetsCometsMoons	news	1	-1	-1	2016-11	1479020468	Tens of thousands plan women's march on Washington
0	"Neither of these are a long term solution to being ""a threat to national security""."	JP20Boss	titanfall	9	-1	-1	2016-10	1476230420	Your Titan can Phase Dash through Hellfire Missiles. Either that or Reflect it back at the Drone. Scorches Flame shield works on Lasers somehow.
1	Well obviously they're just shills.	Mousse_is_Optional	NoStupidQuestions	14	-1	-1	2016-11	1479021724	Literally the entire scientific community disagrees with you on that.
1	aye bro, you need to clean your house	MrChowders	FashionReps	1	-1	-1	2016-11	1479022341	WDYWT - Blake Anderson edition
0	I deal with daily negative effects due to the color of my (white) skin.	Extremefreak17	politics	1	-1	-1	2016-10	1477772083	I grew up relatively poor and white. We all get dealt a similar lot and get shit on in life. The privilege which you take as an insult is subtle though. Being less likely to be pulled over with or without cause. More likely to be looked on favorably by a loan officer or a potential employer. It doesnt negate what youve worked hard for but it is a systemic part of our society. It might not be directly improve your but just be the lack of a negative effect others are forced to deal with.
0	"""Why are you in my seat?"""	inthedrink	aww	1	-1	-1	2016-12	1481797036	My boy turned fiftheen y/o today, we've been buddies since I were 5. Followed me up mountains and to the cities.
0	Isn't tiger stronger early game?	VargLeyton	leagueoflegends	1	1	0	2016-09	1474534308	in general: vs phoenix: snowball early or hold out til late vs tiger: snowball early or end game during midgame
0	Every year the age requirement to be an adult goes up by one year.	TheBoiledHam	pics	8	-1	-1	2016-12	1482900621	~21 yrs old is still a child to you?
1	This is Reddit, sarcasm will result in you being downvoted to the depths of hell unless you end your post with	earlsweaty	tifu	2	-1	-1	2016-11	1479032702	Periods are pretty fucking disgusting right.
0	He'd have an innie	Garper	Tinder	1	1	0	2016-09	1475205266	And if my expectations were at zero?
0	If you search an individual object rather than a wing or a cell, it's 100%	XeliasSame	nerdcubed	1	-1	-1	2016-10	1477386436	The thing with searching is that it's only a percentage chance of uncovering a tunnel
0	*is You can still fire up R6 and see for yourself.	sebool112	Rainbow6	0	-1	-1	2016-11	1479233178	Dude it was not as good as you describe at all.
1	Clear tape	marsrover001	CarAV	2	-1	-1	2016-11	1479037218	Door Handle Rattle
0	Is it a shotgun that turn people into homosexuals?	PUTTHATINMYMOUTH	australia	5	-1	-1	2016-10	1477221009	You'd think so but now it's all this malarkey about that shotgun
0	Bitcoin isn't a company.	DJBunnies	Bitcoin	1	-1	-1	2016-10	1477144603	"He should have gone with ""[insert any successful company here]""."
1	Since Intel has been calling their processors with prime numbers (Core 2 quad, Core i3, i5, i7), the next should be the i11 and the i13.	Hanneman_213	pcmasterrace	6	-1	-1	2016-11	1479039477	Core i9?
0	Doug flutie	iateyourcake	nfl	2	2	0	2016-09	1474930588	On paper what players should never have succeeded in the NFL but did anyway?
0	In my defense, I never played XII and it's kind of hard to tell her hair is white from her sprite.	BitiumRibbon	FFRecordKeeper	1	-1	-1	2016-11	1480131434	If it's not limited to male only, Fran also would like to have a talk with you
1	Now that's what I call a mandate!	im_probably_eating	politics	0	-1	-1	2016-11	1479045642	Trump's popular vote deficit may approach two million
0	Right!	MyNameIsKELVON_YATES	reactiongifs	1	-1	-1	2016-12	1481418452	Ian McShane can make any role awesome
0	Pretty sure IW was down aswell if I'm not mistaken.	ranf0rd	CODModernWarfare	1	-1	-1	2016-11	1479048369	Oh. I thought it might be maintenence or something.
0	It's because he knows any new manager will demote him from a starting spot.	ImRakey	soccer	6	-1	-1	2016-11	1479048705	Gareth Southgate should be made England manager - Wayne Rooney
1	Pokemon	Panda_Erick	AskReddit	1	-1	-1	2016-11	1479050109	What's the perfect example of a game company running out of ideas?
0	This is literally the story of my life.. For me, if there is an arty in the game, there is a 90% chance that i will get hit, regardless of what i am in.	willyoung1999	WorldofTanks	1	1	0	2016-09	1473815817	It's finished! After almost countless painful deaths, I bring you one of my finest pieces! Death by Arty Compilation - Dynamic and Balanced Edition
1	I prefer using Nova	KeySolas	gadgets	1	-1	-1	2016-11	1479050952	"Should've named it ""P90"" instead so we could rush B with it."
0	Everybody is playing like shit.	TypicalJaxFan444	Jaguars	4	-1	-1	2016-10	1476643553	Second Half Thread vs the Bears Not even calling the Jags in the thread. We dont deserve to call us a real NFL team.
0	I was thinking of subtly doing something like that with my match, by simply upvoting a comment they posted 2 yrs ago haha.	IIIAnomalyIII	secretsanta	2	-1	-1	2016-12	1480830552	I think mine kind of hinted to me who they were in a comment on one of my posts.
0	Or the title.	Collier1505	Games	1	1	0	2016-09	1473616218	Like, read the fucking article that's made this thread. Ffs.
0	Vettel for President!	erinha	formula1	1	1	0	2016-09	1472768933	Vettel started laughing at that point
1	Don't make fun of him dude, just look at ALL the facts and you'll see he's obviously right	DickButtV2	interestingasfuck	1	-1	-1	2016-11	1479053673	&lt;grow some mimds
0	"I like the objectivity ""a staggering 21%"".. um ya, staggering."	Soredan	exmormon	1	-1	-1	2016-12	1482643916	New study shows fewer Americans are practicing organized religion (1.8% of the U.S. (~5 Million) identify as Mormon, much less than what the church claims for US membership rates)
1	Stop fetishizing larger WOC!	Wishartless	TumblrInAction	18	-1	-1	2016-11	1479054833	So you're saying if I'm only attracted to certain people, I'm an asshole? I prefer BBW's, am I a scumbag for only seeking out large women?
0	Not to mention Nakamura	YakMan2	SquaredCircle	9	-1	-1	2016-12	1481862223	Just imagine if we had Nigel, Daniel, Kevin, Seth, Joe, Sami, Luke, Cesaro and Austin at the same time in freaking WWE. Nothing worse in wrestling than careers being cut short.
1	Oh, I'm sure it's just a few bad apples.	HappyCloudHappyTree	politics	54	-1	-1	2016-11	1479055923	Hate Crimes Soar Across the US After Donald Trump Elected
0	There is no way you would use a slug to do something like that.	rugger62	nonononoyes	27	-1	-1	2016-12	1480729984	"He was most likely shooting a ""slug"". It's just a round like piece of metal in the shotgun shell. I know he didn't use a bird shot or buck shot because the pellets will spread and hit the elk."
1	Wow, totally not staged.	drskyraider	TwoXChromosomes	3	-1	-1	2016-11	1479056555	"""Whistling At Your Mom"" - a Peruvian TV show finds the mothers of men who catcall women, do makeovers on said moms, then have them walk by their sons so they can firsthand see their sons' behavior."
0	"I found ""House"" had some real facts in it"	analgesic1986	AskReddit	2	2	0	2016-09	1473086742	Medical personnel of Reddit: What television shows consistently get things right?
0	I would be a thief.	analgesic1986	AskReddit	1	1	0	2016-09	1473727232	You get the ability to teleport as well as go invisible, using them to your strengths what start up/business would you select to become successful?
0	You dropped an e op	analgesic1986	AskReddit	1	1	0	2016-09	1475096399	Where did you met the person you are in love with?
0	Now coming to a nation near you!	shorthairedlonghair	Liberal	6	-1	-1	2016-11	1479750284	Hard times for Kansas and its schools as economic 'experiment' creates gaping budget hole
0	Hell in a Cell* not Hell in the Cell GODDAMNED AMATEURS	othniel01	SquaredCircle	-1	-1	-1	2016-11	1479502422	Picked these up at a comic con last month, they really tie my living room together.
1	exclusive Destiny features for PS4, so XBO users get fucked over	kingwroth	xboxone	8	-1	-1	2016-10	1475433708	ELI5: Why do some games download super slow but others don't?
0	OK degenerate	TrumpEnergy	politics	-23	-1	-1	2016-12	1482936463	No one cares that some rando professor triggered your precious feefees. Especially not the legal system.
0	Depends entirely on the bank / company, mine has no time limits on chargebacks.	ThePopesFace	legaladvice	3	3	0	2016-09	1473896999	Although a payment made in May may be too late for a chargeback now, doesn't it have to be done within two billing cycles?
0	Because if it's just going to be wasted, then you can eat it!	Draco-REX	gifs	-4	-4	0	2016-09	1474849355	Then why say it?
0	Cheers	Pachysandra108	vegan	1	-1	-1	2016-11	1479248196	Yeah , this subreddit is the one place I can tuck myself away and feel accepted and positive.
1	"But aren't we suposed to close the sub to focus on the ""political revolution""?"	Sususu77	The_Donald	1	-1	-1	2016-11	1479060150	We reached 290.000 ! WOOHOO!
0	I think that's a brilliant and unique solution right there.	SAWK	DiWHY	8	8	0	2016-09	1473049823	I know you say that, but I think you're forgetting the importance of a sealer
0	I'm torn between the Rubicon at almost $300 off on BHQ right now for the discontinued Spydie sale, or seeing if the ZT0450 or the 0452 goes on sale.	the_nerdster	knifeclub	1	-1	-1	2016-11	1479062314	The Magnitude has kicked everything else out of my pocket for now. As for the Rubicon it seems like it's just a smaller version of this knife and not much it different, if your in to smaller knives I'd say pick one up.
0	I have one that looks the exact same, I took it out of my hp d530.	lightningstrike46	pcmasterrace	1	-1	-1	2016-10	1477010782	Biggest internal speaker I've seen in my life.
0	I'm on PS4 and my timing is good.	gotmiIkman	NBA2k	1	-1	-1	2016-10	1475287657	Slasher help. Max layup, max agility, decent strength. *bricking easy layups* Fast break? 1v1? Missed layup, every time, no matter how close to green I get. WHAT AM I DOING WRONG. I have never been able to make layups, they really broke them this time around, 41% fg for the season so far.
0	But just wait for his surprise attack...	PopcornInMyTeeth	politics	4	-1	-1	2016-10	1477656166	The Campaign Battle of Mosul: Gen. Allen Says Trump Undercutting Operation
0	You have to find a goalie that fits your play style best.	yantzi	NHLHUT	1	-1	-1	2016-11	1479521808	Why do they all suck? Is it just me, or are all the goalies junk this year? I can't seem to find a goalie who does the job for me. Bishop and Luongo have been the best for me, but still, they aren't they best
0	1 second later*	luffy300mb	Overwatch	47	-1	-1	2016-10	1477593523	gets destroyed 1 min later.
0	We did it to y'all before after all	9thWardWarden	CFB	5	-1	-1	2016-10	1475983897	LSU Med Center is more than willing to sterilize their axe to chop those boners off
