1	Yeah, like the complete economic collapse that Brexit caused right?	cogsandspigots	AskReddit	-3	-1	-1	2016-11	1478668325	What the actual fuck America? This is just so fucking sad, I guess all we can do now is just sit back and watch the world economy go to shit.
0	same here, I really want to see Katana in the Harley Quinn movie	Djandyt	DC_Cinematic	13	-1	-1	2016-11	1479707328	Karen is so beautiful,i hope we get to see more of Katana in future movies
1	Sorry, I'm a Trump supporter, I am too stupid to understand such a sophisticated term....	BrauneAugen	The_Donald	1	-1	-1	2016-11	1478670970	cognitive dissonance
0	National television games are blacked out, but I'm working during the game and I know for a fact that you can watch the replay on the LP app a few hours after the game is over	The-Kingdom	bostonceltics	1	-1	-1	2016-10	1477559726	Would tomorrow's game still be on league pass even if it's on tnt?
1	shhh you're interfering the purpose of this post	d0ggo1	pics	0	-1	-1	2016-11	1478674542	No scandals? Everything that they are hitting Hillary on happened under his presidency and he brought her in. The IRS targeted groups based on political leanings, the pulling of AP phone records illegally, the Veterans Affairs appalling practices, Good ol' Solyndra as a capstone of his energy policy, and most recently all the doomsday predictions about Obamacare are coming true. So only an idiot would call his presidency scandal free.
0	They've been so wrong over the past year, and they'll continue to be wrong.	UpVoter3145	The_Donald	6	-1	-1	2016-12	1483201584	"Cucks two months ago ""Donald Trump has no chance of winning and The_Donald is going to die out after the election"" Many weeks after the election:"
1	I can't believe all these negative Hillary posts on the first page	CareToRemember	politics	1	-1	-1	2016-11	1478676111	As usual, the Democratic Party manages to snatch defeat from the jaws of victory. Fucking hell. Why the fuck can't they learn their fucking lesson?
1	Who's more anti establishment than the first woman president?	FriscoGuy	politics	6	-1	-1	2016-11	1478676228	Especially an anti-establishment candidate who could draw in those votes. Shame there was none.
0	Then I can safely assume you've been living in a cave the past few days, with all the ridiculous protests and whining you've supposedly never heard about.	BpshCo	news	11	-1	-1	2016-11	1479029425	No it isn't. This is one insane person. 61 milllion people voted for Clinton. This one asshole isn't an accurate representation. Quit your bullshit.
0	I love how xir provided sources for xis claim.	angrytapir	TumblrInAction	1	-1	-1	2016-10	1477028096	Well that's it guys, science proved it.
0	how do I know whether it's honest question or not?	T1keSenpai	LifeProTips	6	-1	-1	2016-10	1477554700	LPT - Never laugh at an honest question There is no winning. You either come of as arrogant by inferring with laughter how someone couldn't know something you assume they should, or you just seem outright dismissive of someone who's simply seeking clarity or further explanation of a topic. Asking questions can be difficult for people, always answer the question to encourage someone to better themselves through the pursuit of knowledge. Unless this persons question indicates they are dangerously unfit to be performing a duty that places others at risk, there is no benefit to degrading them. We all want to learn, so let's all be good teachers when we can. The stupider their question seems to you the more you probably know about the topic in question, so take this chance to really open up their world to something new.
1	Black and white always works.	Zain1911	Warframe	1	-1	-1	2016-11	1478678988	Some fashion advice for TWW? I'm preparing for TWW, as are we all, but I'm a little concerned, because I simply have no fashion sense. I'd like some advice. I'm planning on running a Valkyr, since it's my favourite frame, with a Bastet helmet. I'm got a nice little understated blue version, but I was hoping to incorporate my favourite colour into a Valkyr build. My favourite colour is poppy red, and I don't know how well that'll work, especially since I'd rather not go cliche and mix it with black. Does anybody have some advice they think might look nice?
1	I'm sure all those inner city minorities were loaded with bachelor degrees....	westc2	funny	1	-1	-1	2016-11	1478679294	Well that explains a lot..
0	Good to know!	totallynotazognoid84	AnimalCrossing	3	3	0	2016-09	1472863194	When you get Golden tools such as the golden bug catching net, don't sell them! You only get 1 per game without trading with other players!
1	What wouldn't having a woman president be neat?	______POTATOES______	Political_Revolution	0	-1	-1	2016-11	1478680888	turns out simply repeating #i'mwithher and not being populist when the mood of the country is clearly trending that way is not a winning strategy eh?
0	We colonised 1/3rd of the worlds landmass and harnessed all the best foods	rainator	AskReddit	2	-1	-1	2016-12	1481229127	You will not lose a food showdown with England.
0	You don't know how the human body works.	TheAmazingKoki	soccer	20	-1	-1	2016-12	1483213078	Maybe if he was a child. Why is he so weak to go down like that with a push from one hand downwards. That's fucking pathetic, he doesn't deserve a penalty.
0	If it's not federally legal they can't bank money	MrSparks4	politics	4	-1	-1	2016-11	1478681088	Trump is for medical, he is leaving it to states to decide recreational. I heard this on the internet and have seen no sources, so don't take my word as fact.
0	I will feel bad for the bad guys in the universe	lkxyz	dbz	7	-1	-1	2016-11	1480312297	Plot: Arale becomes Jaco's Space Patrol partner and they fight crime together around the galaxy.
0	I mean, people are nonchalant about murders, rapes, and other shit that happens in this country as long it don't affect them.	Damen_aka_Ron_Ron	BlackPeopleTwitter	7	7	0	2016-09	1474391359	This nonchalant attitude is kind of scary. All I can think is: Do you want the middle east Because this is how you get the middle east Like we're not even really caring about explosions in our own country now...
1	Her staff left the office.Was she supposed to write her speech on her own?.	MaksweIlL	news	92	-1	-1	2016-11	1478682483	I saw someone else say that she didn't actually write a concession speech and I can kind of see that. I'm sure she thought she was a sure thing, it's possible she didn't write one and thus couldn't address the party.
1	Dear USA, We will take you back, Love from the UK	Aegon-the-Conqueror	news	3	-1	-1	2016-11	1478682663	Donald Trump Elected President
0	That explains all the memes	SamuelCish	Showerthoughts	1	-1	-1	2016-12	1481058824	You're dead now. Welcome to hell.
0	They both are, but thank you for admitting it, unlike most people.	Skylar2k5	the_meltdown	267	-1	-1	2016-11	1478682673	Same here, I'm not even mad she lost. She was a pretty shit candidate anyway.
0	Wow, that sucks!	coltsmetsfan614	AdviceAnimals	1	-1	-1	2016-10	1476566142	It's actually $1.75 for both the washer and dryer.
0	She should probably try running for a realistic office first.	coltsmetsfan614	politics	12	-1	-1	2016-10	1477912868	Climate change, erasing student debt top policies for Stein
0	Yeah seems about right.	thatsgrossew	politics	1	-1	-1	2016-11	1478919825	The strength of democracy is to take the absolute worst options out once they start ruining everything.
1	I like how you automatically assume i voted trump not Stein You seem like such a nice, non-violent person, just like hilary	Shrike99	politics	3	-1	-1	2016-11	1478684757	Pretty good, going to be fun watching the clown impeached hahaha. Now it's going to be payback for Obama. Can't wait to watch you clowns burn along with the groper getting dragged out on the streets and lynched
0	He is quite literally too based for anyone.	Michmatch	The_Donald	2	-1	-1	2016-11	1478684943	TRUMP ENDED TWO POLITICAL DYNASTIES THAT DOMINATED AMERICAN POLITICS FOR THE PAST 30 YEARS IN 16 FUCKING MONTHS HOLY FUCK!!!!!!!!
0	Im really pumped for all the election memes once the new president is elected.	doublepoly123	BlackPeopleTwitter	12	-1	-1	2016-10	1475518357	We coulda had /#Election2016Clapback but I think they're already doing it for us
0	I don't remember too well, and I'm not sure how far you've got through the campaign so I don't want to spoil anything, but I think it was down to Pagan.	SonnySoul	farcry	2	-1	-1	2016-10	1476279508	Was it Yuma that allowed us to escape from Durgesh? The cell door was left open
0	I don't see where it really affects them.	Helyos17	news	1	-1	-1	2016-11	1479242723	I missed missed the part about fucking over people legally trying to get in by skipping the line...
0	Is it really that huge of a headache to manage or is that only when your tenants are dickheads?	doughboy011	politics	5	-1	-1	2016-12	1480707622	Rental income is considered passive income by the IRS. I also have a rental property.
0	You are assuming people switch to counter in quickplay.	32Ash	OverwatchUniversity	1	1	0	2016-09	1472827450	How do they deal with 2 Ana's and some sustained fire?
1	Very interesting thread.	Tu_Fui_Ego_Eris	hearthstone	1	-1	-1	2016-11	1478693187	"I Met Amnesiac 15m After Pavel Loss Honestly. He was a class act. 100%. I introduced myself, said I was a fan and that I just wanted to shake his hand. Then I gave him the polite out ""I'm sure you're busy, just wanted to say hi"". His response shocked me given the persona I was expecting. ""No worries man. My name is Will. I'm not in that big of a rush, and I'm happy to talk for a minute."" His composure and care with a fan given the context were really impressive. I'm happy to see those attributes in top players, especially in a game I care so much about. TL;DR Will (Amnesiac) is one classy m@therf*cker."
0	I'd use it, yay!	DemrosOfficial	arma	1	-1	-1	2016-11	1478694353	Custom CTRG Units: Yay or Nay?
0	I've actually accumulated several 10s and 17s over the time I've had these cars, haha.	Abluemillion	BMWE36	2	2	0	2016-09	1473963504	"""Where'd the 10mm go"" - story of my life..."
0	Man, some people just really shouldn't drink.	Sterling_Archer88	JusticeServed	2	-1	-1	2016-10	1476556105	Bodycam Shows Drunk Idiot Arrested By Police
0	What's worse is she felt she deserved and was entitled to win; ergo too cocky.	Sceneselector	TwoXChromosomes	112	-1	-1	2016-11	1478698656	Disenfranchisement was Hilary's goal. She literally tried to guilt the American public into feeling it had to select her or we were all horrible people dwelling in caves dragging our knuckles.
0	In before IRS investigates Elon Musk several times, finding nothing wrong, yet insists on harassing him.	BlackSpidy	politics	3	-1	-1	2016-11	1479854726	Good.
0	I will always be here for you... In spirit.	BlackSpidy	AskReddit	2	-1	-1	2016-10	1475769299	hey man, I need a ride, can you come pick me up?
1	Yeah, why didn't just rush out a half-assed attempt earlier?	bilog78	linux	1	-1	-1	2016-11	1478699898	Ubuntu has been 'moving to QT soon' for about 6 or 7 years now.
1	C'mon, why remove the BR if Trump can just downgrade it to its awful Halo 3 version?	DBCHAR1ZARD	halo	2	-1	-1	2016-11	1478701621	I'm hoping he'll be able to remove BR starts from BTB. I'm all about #BRexit
0	No, the test season has already been closed.	Yetkinler	empirepowers	1	-1	-1	2016-12	1482191370	I signed up for the test season in the modmail. Am I in?
0	He has a habit of being late to teleport that they really need to work on	Alvarus94	leagueoflegends	2	-1	-1	2016-12	1481845395	Lourlo is a beast Naut and he actually was a deceptively good laner through most of the summer split, not so much in terms of picking up huge CS leads but scoring solokills (he solokilled Seraph/Impact/Hauntzer/Huni/etc. in lane at least once last split). It's usually his decision making after laning that gets him into trouble.
1	So specific.	satinsartre	AskReddit	1	-1	-1	2016-11	1478703374	For example, something to do with the filming of a movie/tv show or the writing of a book. It's not something that happens within the story itself.
1	YA MAKE REDDIT GREAT AGAIN	forpostingaboutdrugs	Drugs	4	-1	-1	2016-11	1478703392	Alls he's saying is: Stop being a fucking sad sack and take a step back every once in a while. While problems and issues are relative to wealth and status, doesn't make yours any more worse than somebody else's. OP could be an 18 year old homeless junkie addicted to Heroin panning daily just to afford his next sack. In retrospect, the kid needs to stop fucking doing drugs, quit the benzos, get a proper job or pursue higher education. Literally 6 months off drugs will be enough to change his life. Him posting here for a bit of karma and circle-jerk 'depression comfort' will solve nothing. We need more people laying down the reality of situations, offering real solutions to problems. REGARDLESS of how many feelings are hurt. Fuck yo' feelings
0	What did you take instead of RBs?	sonofabutch	fantasyfootball	1	1	0	2016-09	1473119842	I waited way too long to start grabbing RBs and ended up with Rawls as my RB1 so this is a terrifying nightmare if true.
0	I like you for using Python :)	yovliporat	feedthebeast	1	-1	-1	2016-11	1478703851	GitHub - Pinaz9/DandelifonSimulator: A simulator for Botania's Dandelifeon
0	There was only one original video - the one I linked to.	freediverx01	thedivision	0	-1	-1	2016-11	1478707872	Every video that came before the game was an introductory video... again you can't cherry pick. The beta clearly showed this aspect as well. They showed all of their intentions prior to launch I can find no fault in them for non-disclosure.
0	I didn't imply he did, just a stat comparison.	crash218579	nfl	1	-1	-1	2016-11	1480164654	Id argue that you can't just look at stats in a vaccum. RG3 carried that offense (and team), Dak is a key part of the offense but definitely not carrying it like RG3 did
1	We all just need to quit being so sensitive	greatballsofmeow	TrollXChromosomes	12	-1	-1	2016-11	1478704528	"There were the religious, but also the racists, sexists, fat shamers, slut shamers and bullies everywhere. Oh wait, they aren't those things, they are ""straight talkers"", telling the truth even when political correctness is unfairly picking on them. As soon as someone says trump is a straight talker, you know that person is one of those."
1	Assad is evil so let's replace him with some random cunts who will introduce a new era of Islamic fundamentalism to Syria	BREXIT_WONDERBOY	worldnews	83	-1	-1	2016-11	1478705155	1) What are we supposed to do that we haven't already done? 2) Is Assad worse than the fundamentalist militias that are rebelling? 3) Who knows. Russia wants to be a regional hegemon, not a super power.
0	Sun's campus in Palo alto had this in the late 90's	Captain___Obvious	programming	1	-1	-1	2016-10	1476066289	On one side, you have cubicle nightmare. On the other side, you have the open floor mess. 2-3 developers per room, all in the same project. Works as a charm, but nowhere is done like that. I don't understand why.
0	You were thinking about starting a fetus cremation business too?	jrhiggin	Austin	6	-1	-1	2016-12	1481853532	Guess I don't need all of these shoe boxes after all
1	Please use they/them pronouns!	TheBigBitch	masseffect	7	-1	-1	2016-11	1478707332	Legion was my favorite. Everything about it was badass.
0	We're better off waiting for next gen so there will be mass adoption software for it too.	Bombasticrifter	oculus	3	-1	-1	2016-12	1480700853	I hope the Rift gets some add on hardware from 3rd parties for face tracking and eye tracking. There's already an add-in eye tracker for the vive but it's expensive iirc. Probably small scale manufacturing = high cost. Someday tho
0	This mentality is why millennials can't get jobs in their profession.	vulbvibrant	politics	-2	-1	-1	2016-11	1480527322	"If you want a job, you cant just say ""prove to me that the person who currently has the job deserves to keep it"", you need to make an argument for why you (or tim in this case) would be better. People generally deserve to keep their jobs unless there is a specific reason why they dont."
1	Yes, people are worried about having a united government, not about having a united government that has repressed and endorsed violence against marginalized people for decades	gwennoirs	AskReddit	1	-1	-1	2016-11	1478708491	Then you better leave too. Having a united government that can actually get shit done instead of one that shuts down all government facilities is something all true Americans should love.
0	you know it's a well rounded person when they immediately attack you before accuse you of attacking them, then give an A B C response to your polite reply.	hisgrossness	SampleSize	7	7	0	2016-09	1473449425	I'm not insulting anybody. I'm not the one who downvoted you, either. Again, thanks for the input.
0	Is there an Alternate Link, besides facebook?	morridin19	bicycling	2	2	0	2016-09	1474651280	Interesting engineering report on bike lanes
0	I'm a millenial and i am happy with trump, sure, pence terrifies me, but trump, i have to say, that acceptance speech was the most gracious and inclusive speech i have ever seen from a politician in my LIFE, I kinda hope trump WILL Make America Great.	LoonShy	HillaryMeltdown	2	-1	-1	2016-11	1478708762	Millenials...
0	How much does the average abortion cost?	jershuwoahuwoah	TwoXChromosomes	1	-1	-1	2016-11	1479237135	I agree with you and know it's not affordable to many people but if an abortion is cost-prohibitive having a child is even more so.
0	This is also true for the egg hatching mechanic; all the eggs in a stack have to be average 100% to hatch, and they all do at once.	Charliek4	RimWorld	3	-1	-1	2016-11	1479748223	They get averaged. This typically ends up working in the player's favor.
0	Marathon... that takes me back	justMeat	Warframe	7	-1	-1	2016-12	1482766494	Here's a throwback to u/RireMakar RHINO PRIME HAS NO GOOD BUILDS. HE HAS THE BUILD. THE ONE TRUE BUILD. YOU SEE. TAKE RHINO AND PUT ON REDIRECTION. YES, LIKE THAT. NOW, VIGOR. NOW VITALITY. NOW, STEEL FIBER. YOU WILL BE STRONG. LIKE RHINO. YOU WILL DESERVE THE RHINO NAME. NOW, YOUR AURA. STEEL CHARGE IS ONLY WAY. OTHER AURAS ARE MEANINGLESS. STEEL CHARGE MAKES YOUR STEEL HIT HARDER. HARDER HITS ARE GOOD. RHINO IS GOOD. RHINO HITS HARDER. FOR OTHER MODS. YOU WILL ONLY BE NEEDING FEW. ONE IS RUSH. RUSH IS GOOD. RUSH MAKE RHINO FAST. FAST MAKE CHARGE HURT ENEMY. RUSH MAKE RHINO CHARGE HURT ENEMY. YOU MUST ALSO PUT ON QUICK REST. MORE STAMINA EQUALS STRONGER RHINO. RHINO WILL HIT MORE. MORE WILL DIE. WHEN THEY DIE RHINO IS HAPPY. STRONG RHINO IS HAPPY RHINO. TO MAKE EVEN STRONGER RHINO, ADD MARATHON. MARATHON MAKES STRONGER RHINO AND MARATHON MAKES HAPPIER RHINO. YOU DO NOT NEED FLOW OR STREAMLINE. RHINO NEED NO GREAT ENERGY. RHINO HAS STRENGTH IN MUSCLES. THIS STRENGTH IS ENOUGH. DO NOT FORGET WEAPON. RHINO LIKE VERY FEW WEAPON. BEST WEAPON IS JAT KITTAG. RHINO CRUSH SPINES WITH JAT KITTAG. OTHER WEAPON INCLUDE SCINDO PRIME OR FRAGOR. VERY HEAVY WEAPON FOR VERY STRONG WARRIOR. RHINO ALSO SOMETIMES USE FISTS. ANY FIST WEAPON WILL DO. RHINO NOT NEED THEM ANYWAYS. ONLY WEAR THEM BECAUSE OF OBSCURE TENNO LEGAL REGULATIONS. GET RID OF OTHER COWARD WEAPONS. YOU WILL FIGHT ENEMY CLOSE OR YOU WILL GO TO ENEMY. THERE IS NO KILLING OF ENEMY FROM AFAR. THIS IS TRUE RHINO. YOU ARE NOW TRUE RHINO. GO FORTH, WARRIOR RHINO. DESTROY ALL YOU SEE. HAIL, RHINO PRIME, GOD OF WAR.
0	The man doesn't accept basic scientific facts, but sure, OK, yeah, EVERYTHING is going to be JUST fine... You're absolutely delusional.	carbondioxide_trimer	gaybros	9	-1	-1	2016-11	1478710568	Everything is going to be fine. There is nothing to worry about. LGBT rights have already been ruled by the Supreme Court so there is no changing any of that. The president doesn't have as much power as you think they do. It's great that we don't have a Washington elite in the White House right now. All you see on the media was meant to scare you. Look at trump on paper rather than what you've seen or heard from the media and the people around you. As a transgender person and member of the LGBT community, i thought I'd be the last person to even think about supporting trump. I may not agree with a a lot of things the Republican Party supports, however trump is different. There is a reason why a lot of his own party doesn't want to support him. With all that aside, the only things that will change are other matters, but civil rights I think we are safe. We just have to ride the next 4 years out. For once the people have been able to have a voice in our own elections that go against the bribed government and business, you may not like or even want the current president elect, but my friends what has happened I believe is a good thing. With all that said as long as the country doesn't explode out into an all out riot. Everything is going to be okay. I already know that a lot of you are going to come out and comment and rage with your own opinions because of this, and that's okay. Everyone is entitled to their own opinion. I'm just simply trying to offer some comforting words.
0	Yes, the precedent of repealing amendments to the constitution should frighten everyone, in over 250 years we have repealed one, and the massive groundswell in the media about the effort to repeal the 19th should scare everyone, they can't stop talking about taking women's right to vote, the commentary is non-stop.	NosuchRedditor	politics	1	1	0	2016-09	1475170630	There's a non-zero probability that a Trump presidency leads to women losing the right to vote. Let that sink in.
0	I think they'll have local mass relays and they'll say its state of the art tech that they have harnessed the power of the relays.	tony_lasagne	masseffect	1	-1	-1	2016-12	1480719488	I'm guessing there isn't going to be relays in the new galaxy so I wonder how they are going to address long range travel?
0	don't jinx it or he will get his ACL torn :\	zazone	soccer	7	-1	-1	2016-11	1478710963	Wow that's really exciting. I think we hit the jackpot with this kid.
0	ok give me a hypothetical misled context where the stuff they said isn't criminal	collegeeeee	politics	8	-1	-1	2016-10	1476723176	not necessarily, Okeefe has edited videos in the past to mislead.
0	you have to get an after cooler tho, and watch a lot of guides before you do anything and test it a lot and it will take some time and be carefull with the voltages you may kill your cpu/mobo	zecro48	buildapc	3	-1	-1	2016-10	1475603570	I will may be overclock it! Thank you!
1	He is already dead	sampo_4	AskReddit	1	-1	-1	2016-11	1478711801	Nelson Mandela will die
0	It contains opposite research on some Republican Congressmen apparently.	cl33t	politics	1	-1	-1	2016-10	1475616146	"I can't believe there is an alleged folder called ""Pay to Play"" - no way. Just no way. That would take ""extreme carelessness"" to a whole new level."
0	Would love to see some original content on this sub today..	the_Gnocci	Overwatch	1	-1	-1	2016-12	1480687378	Bastion is a hermaphrodite
0	The tackles would be a lot more brutal.	Ghost4000	cordcutters	1	-1	-1	2016-12	1481238153	An even playing field? Fuck that! You think football is on an even playing field? Hell no. Away team runs uphill all game, because this is America!
0	Depends on how many bees you have :)	SerouisMe	Futurology	1	-1	-1	2016-10	1477668631	"""Need"", no. But more bees is better than less bees."
0	If you think about it, it's really the only way.	sometimesynot	AskReddit	2	-1	-1	2016-12	1481216400	First I need a failed suicide attempt due to my wife coming home early followed by surviving getting T-boned. Alrighty!
0	I second that, not really my scene but the 'hatch is always good fun..	mister_314	bristol	1	1	0	2016-09	1474053163	There's All Stars Sports Bar on Park St for the pool and then the Hatchet down on Frogmore St for the punk/Rock music
0	IIRC Snopes is owned by a Clinton donor and the guy is a registered Democrat.	freedomna	The_Donald	3	-1	-1	2016-12	1482506344	Please correct me if I'm wrong. I thought Snopes were as impartial as one can get these days and treated the Donald fairly in most cases.
0	No, because hate speech isn't free speech.	darthhayek	Libertarian	0	-1	-1	2016-11	1479166282	Is it just me, or does anyone else think Hillary would've been a bigger threat to the 1st amendment than Trump will?
0	And if you don't believe in Christianity, Jesus doesn't exist.	heretoplay	comics	-10	-1	-1	2016-12	1482687224	The joke: Jesus wasn't actually born on Christmas Day. It's a pagan winter solstice festival that was adopted into Christianity by the Vatican during the middle ages. No one actually knows the real date when Jesus was born.
0	Well a lot of people compared Overwatch with Team Fortress 2, yes there's a huge difference in both games, but seeing how Valve is a huge fan of microtransactions, I am glad that we've actually got a way to obtain free boxes, without the need to buy keys with IRL money.	Jeromu	Overwatch	4	-1	-1	2016-11	1480513939	Overwactch made by valve I've always been a blizzard fan, I love overwatch and hearthstone, but the games I played the most were valve games (CSGO, DOTA 2, TF2 ...) and I always wondered what Overwatch would be like at valve hands. How would the customization, history, characters and gameplay I always wondered how it could be
0	i believe you're thinking about Crytek, not CDPR	PimpCinnamon	xboxone	19	-1	-1	2016-12	1482090077	Maybe now they can pay their employees.
0	"Nothing says ""We want to be taken seriously and our issues to be taken into consideration"" like acting like animals."	zstansbe	news	7	-1	-1	2016-10	1476725708	Protesters demanding free education throw excrement at South African university
