1	Ah, I guess my anorexia was making me eat food in my sleep and that's why I'm so thin, not because I wasn't eating!	nikitafr	fatlogic	5	-1	-1	2016-10	1475795455	"""No Excuses Mom"""
1	It's ok guys, once she's POTUS she cannot be blackmailed.	leemachine85	HillaryForPrison	2	-1	-1	2016-10	1475799318	DOJ Dismisses Charges Against Arms Dealer Who Threatened To Expose Hillary Arming Extremists
1	Yeah healer's the most complicated, that's why girls all play healers disproportionately.	Ultramerican	wow	0	-1	-1	2016-10	1475801275	Sure, but doing the bare minimum as a healer is doing more than doing the bare minimum as a DPS, that's my point. DPS needs to pay attention to shit on the ground, and their rotation. Tanks and healers need to pay attention to shit on the ground, their rotation, and the others in the group. As a DPS, I literally don't have to look at anyone else.
1	IT WAS THE PEASANTS BURN THEM BY THE WORD OF GOD	Renato_Lopes	pcmasterrace	10	-1	-1	2016-10	1475802309	I'm more bugged about how the yellow bar is missing a chunk.
1	We didn't ask for *logic* and *reason* here	neihuffda	OldSchoolCool	1	-1	-1	2016-10	1475803063	Does the fact she is photographable not disqualify her?
1	Still less of a hawk than Hillary.	Bricktop72	politics	4	-1	-1	2016-10	1475805086	'Wouldn't it be nice if we attacked first?': Donald Trump floats military strategy ideas
1	It's only fair that British nationals get priority treatment in the NHS, they pay for it after all....	_tpyo	unitedkingdom	1	-1	-1	2016-10	1475820861	So simply requiring proof of immigration status is a slippery slope to something sinister? Should we stop checking it entirely to be on the safe side?
0	Dude I've openly heard people chatting about a celebs boobs not to mention their lips.	Time_Independent	Sherlock	8	-1	-1	2016-10	1475916343	Let's flip the gender of the person in question 'mmm I like her lips'. Yeah pretty fucking pervy.
1	yes eliminating surplus value exploitation sure does make lazy people happy	BuddyDogeDoge	sips	7	-1	-1	2016-10	1475825406	I've read a lot about socialism actually when studying JFK and the cold war. It rewards the lazy and punishes the skilled people who do harder jobs.
0	Whites have a higher chance of being shot by police.	drosslord	AskReddit	-1	-1	-1	2016-10	1475826149	That's more easily said when you're on the side that isn't being shot at.
0	Down vote and move on.	Huffaz_bn	Brunei	1	-1	-1	2016-10	1475991099	Do you think Buddhism and Christianity is a threat to Brunei?
1	Yeah and 500-600 PPI on a 6 inch screen is totally necessary.	tredeus	Android	19	-1	-1	2016-10	1475838881	NVMe is overkill for phones and completely unnecessary.
1	HE'S ASKING ABOUT REDDIT FOR INTERNET TRAFFIC.	poohspiglet	AskReddit	1	-1	-1	2016-10	1475841358	What in the fuck are you asking?
1	we make america great again by bringing back horseshoes and blacksmiths	KaieriNikawerake	AskReddit	2	-1	-1	2016-10	1475846075	Not a native, but I live in WV. Yes, people think he will bring coal back and make America great again... :(
1	Yes, I'm definitely bragging about buying cheap jerseys through aliexpress.	Ducling	minnesotavikings	18	-1	-1	2016-10	1475846881	"""Look at how many jerseys I own!"""
0	I'd say no but hey I'm the one who brought it up, so take it with a grain of a good start.	rrbbkk	civ	2	-1	-1	2016-10	1475856068	is it a bad sign if I know what you are talking about?
1	Because titles with RANDOM WORDS in ALL CAPS are TOTALLY TRUSTWORTHY.	JPO398	The_Donald	1	-1	-1	2016-10	1475857997	WikiLeaks Just Released HUGE BOMBSHELL That Proves That Hillary Committed TREASON
0	As a Russian immigrant going through the nationalization process right now every time I hear shit like this my head grows bolder.	anpwn	news	1	-1	-1	2016-10	1475858524	Just hearing about a Russian spy makes me feel so nostalgic. Before we had wars on terror and drugs we had the Cold War. Seemed like simpler times just having the specter of nuclear annihilation always present. At least we didn't have to take our shoes off at the airport.
1	New sounds are coming next week i heard maybe a new ar15 sound?	Zatthorn	GlobalOffensive	2	-1	-1	2016-10	1475862620	Blame video games but don't pass better gun laws. They would be pulling a Valve
1	Just walk around in whiteface and you won't get shot.	Threeedaaawwwg	BlackPeopleTwitter	40	-1	-1	2016-10	1475863455	Dress as a clown, feel safe
1	Shes trained in knife usage, because as a woman, she should be in the kitchen ^	polprog	TumblrInAction	1	-1	-1	2016-10	1475917488	Partially Weapons Trained
0	Have you tried verifying the integrity of your game files if you're on Steam?	shiny_shake	CitiesSkylines	5	-1	-1	2016-10	1475939422	Please, I need your help community I cant start my game and have no idea why. Whenever I load a game, my computer crashes after a few second into the game. Computer turns off and after 5 seconds on again. I tried everything that is within my possibilities. Graphics stress test, Core temperature, latest Bios, reinstalled, removed every workshop content. Do you have any Idea what might help me playing this beautiful game again? CPU: i7-4900K RAM: 8GB GPU: Nvideo GTX970 (4GB) Win 10 (64bit) Gigabyte G3 H97
1	Well if she can't satisfy her husband, how is she going to satisfy the country?	jimbo831	EnoughTrumpSpam	3	-1	-1	2016-10	1475947228	I don't even want to start with the victim blaming and sexual assault they engage in because that makes me so mad, my blood pressure shoots up and my whole day is ruined. Hillary was cheated on. That makes her the victim too. And they act like it was her fault. But then again what else should we be expecting from someone who thinks women should be punished for abortion.
0	This is nice	duff_dingus	deathgrips	19	-1	-1	2016-10	1475960060	I tattooed the bag from the money store
1	He's a robot for the Illuminati, opposing their conspiracies in a ridiculous manner, so everyone resisting the New World Order looks like a fool	sabasNL	ShitAmericansSay	5	-1	-1	2016-10	1475961340	He has no mind of his own. He may even be a bot for all we know (or care)
0	There are lots of mods on steam workshop to either make it so you earn more or less from jobs, just give new profiles tons of cash, or any various number of things.	bonez899	trucksim	1	-1	-1	2016-10	1475969510	Any money mods for ATS?
0	It's just the purchasing power of the average citizen...	Komsomol	ukpolitics	1	-1	-1	2016-10	1476015453	The Value of the Pound Is Not a Measure of the Success or Failure of Brexit - Center For Economic and Policy Research
0	I'm curious, why did you used to think that?	pandoras_enigma	AskReddit	7	-1	-1	2016-10	1476065288	I'm a young female adult and I believed that you couldn't rape your wife till a few years ago
0	You're not the only one!	reliably_rubbish	The_Donald	2	-1	-1	2016-10	1476066586	"When Daddy says, ""I ask Hillary."" All I hear is ""I ask Killary."""
0	"Soon it's gonna be: ""I have a 5% off coupon from Mexico if I build a second wall."""	sakumar	politics	9	-1	-1	2016-10	1477320987	"Mexican will ""reimburse"" us for the wall just doesn't have the same electricity to it."
1	And people say soda companies don't contribute to our nation's health!	donemythyme	news	1	-1	-1	2016-10	1476121467	Soda Companies Fund 96 Health Groups In the U.S.
1	It's not sexist because you can't oppress men due to the fact that we are the end-all be-all kings of all humanity and thus hold all possible power.	epicnonja	TumblrInAction	9	-1	-1	2016-10	1476205204	I could say black people are statistically more violent in America, and that it makes sense to fear them. Suddenly the SJWs stop agreeing with you and you're a racist, but this is not sexist at all.
0	Yeah true but knowing my phone would be locked would surely help me study with a more focused mind	Bloodymage12	jailbreak	1	-1	-1	2016-10	1476205538	It would but since you know about jailbreak and that this is not a full untethered I'm sure you know a way around it so it may not help
1	no, those are public spaces	alegxab	Philippines	4	-1	-1	2016-10	1476206356	They can smoke in their graveyards.
0	That was coaches pick btw	Pranicx	leagueoflegends	7	-1	-1	2016-10	1476210823	When bjerg played against faker at msi in 2015 and picked Ziggs I wanted to chop my dick off. He finalyl gets a chance to prove himself and plays a waveclear mage. lol.
1	It's okay though, ISIS is going to be gone by the end of the year anyway	WanderingWotan	The_Donald	1	-1	-1	2016-10	1476217966	BREAKING: ISIS IED Drone Kills Soldiers
0	You're stupid af if you couldn't tell I was being a sarcastic cunt.	hackeup4bbq	CODZombies	1	-1	-1	2016-10	1476330778	you guys are blind af if you JUST realized that licensed plate. youre late to the damn party.
1	How do you know most Canadians want a referendum if you haven't done a referendum on it?	safety_jam	CanadaPolitics	13	-1	-1	2016-10	1476238887	They're not straight up opposing it. They're promoting a referendum, which most Canadians want.
1	Welcome to the 2016 Republican party, where statistics and data are not to be trusted, because they carry a liberal bias	MemeForce1	politics	1	-1	-1	2016-10	1476292908	My asshole coworker is convinced that the uptick in murder rates in big cities means that murder is higher than its even been in this country. So I won't down his exact words on our whiteboard, then showed him the FBI statistics and asked him if his statement was still true. He said yes. When I pressed him on it further, he claimed the stats were lying, because the Sandy Hook school shooting isn't listed on some official list somewhere. I can't even.
1	And the solution to racial violence can be found on a website.	Daniel_USA	The_Donald	1	-1	-1	2016-10	1476297301	bbuttt nowcast says hililary has a 90% chance of winning!!!!
1	Yeah, everyone with English as their second or third language must speak and write perfectly	Hakul	Maplestory	1	-1	-1	2016-10	1476330842	it's my second language too, not a reason to butcher it.
1	Are you suggesting that not paying taxes isn't a government welfare handout?	BUILD_WALL_PLS	The_Donald	1	-1	-1	2016-10	1476362323	Yes but if you do common core liberal math, he saved all that tax money he didnt have to pay because he lost money so now he has money.
1	I'm sure this a fantastic use of campaign resources.	TrexJesk	EnoughTrumpSpam	2	-1	-1	2016-10	1476375301	CBS News is reporting that the Trump Campaign is moving forward with a suit against The New York Times.
1	Right, but intentionally blinding other drivers is totally okay.	MarinertheRaccoon	AskReddit	3	-1	-1	2016-10	1476379477	I don't flash my high beams repeatedly telling them to get out of my way, though.
1	yes but if it's a video of a BMW it's undeniable quantifiable irrefutable proof that every single BMW driver ever is an arsehole	canada_mike	BMW	10	-1	-1	2016-10	1476379486	Of course the car being driven isn't important here. This idiot could have been driving anything and tried the same stunt.
1	It just means they're good christians who believe in putting America first.	Im_the_expert	politics	1	-1	-1	2016-10	1476383431	Well, some Trump supporters and Tump himself spout stuff that sounds like it cold be from an ISIS video so....
1	Because Crimea never happened.	MikkyfinN	worldnews	139	-1	-1	2016-10	1476384794	Moscow accuses Washington of destroying U.S.-Russia relations
1	Perhaps the bikes should have four wheels and a closed cockpit?	rdm55	formula1	1	-1	-1	2016-10	1476473987	With all the talk about safety in F1, it just surprises me how inherently dangerous MotoGP still is. Dani Pedrosa just had this huge crash:
1	Wow why isn't anyone smiling?	korn474	DC_Cinematic	2	-1	-1	2016-10	1476478725	MoS and BvS: Battle of Metropolis (Scene by scene comparisons)
1	Yeah but if you don't fix 100% of the bugs then you'll lose the respect of the community.	program_the_world	NoMansSkyTheGame	9	-1	-1	2016-10	1476478849	STILL categorizing and fixing bugs? Sorry, but this game is playable on 98%+ of systems now. It's time for these people to pull their heads out of their fucking asses and *communicate with the gaming community* to tell us what the fuck is going on and what we should expect in the future.
0	Very true, Frustrating is a more suitable word than unfair.	TannerHill	iphone	2	-1	-1	2016-10	1476482960	So cancel and buy it in store. It's frustrating, but not unfair. These are logistically two different supply chains. You have individual preorders, and bulk store stock being shipped out. What you propose basically means that stores cannot get any stock until all individual preorders are fulfilled. It just doesn't make sense. Those that preordered early enough did get their phones before bulk store orders. MUCH EARLIER. I received some of my phones around September 24th or so. Some people even earlier.
0	Most redditors don't remember Hulu used to be completely free.	texasbloodmoney	dataisbeautiful	135	-1	-1	2016-10	1476493440	The ad-free version of Hulu is a relatively recent development. Most redditors probably don't know about it and are remembering just how disappointing it was when Hulu introduced the pay-for-ads model. Had Hulu started with an ad-free version, then I think it would be a much more popular option today.
1	But he wasn't white, how could he be racist?	BraveOthello	AdviceAnimals	1	-1	-1	2016-10	1477634322	Gandhi is well known to have been a pretty terrible racist, so they probably heard him just fine.
0	This story rocks	ShareDVI	DMDadJokes	9	-1	-1	2016-10	1477645602	"True story Last week our party ended up at an impasse in some tunnels under a mountain. Having run out of ideas as to how to proceed, the party turned to my character, a Water Genasi Coast Druid, looking for any thoughts he might have on this. I just shrugged and said ""I'm out of my element here."""
0	Turning 41 in a couple of days.	Nilmandir	gay	2	-1	-1	2016-10	1477652755	Any gay Redditors over 35 or older here? I'm just curious as I'm assuming that most gay Redditors seem younger. I like that you can find a community here but I can't help feeling older and at a different life stage somehow...(not meaning to be ageist so I hope I'm not coming off that way), just that it gets harder to make friends there older you get so it'll be nice to know I'm not the only one.
1	Doesn't work at all on netscape with windows ME	pull_my_finger_AGAIN	web_design	14	-1	-1	2016-10	1477652910	It's not very smooth on this MacBook Mid 2010.
1	Sorry man, clearly this is a place for cynical assholes only.. OP's joy is not welcome here!	palmermarc	woweconomy	1	-1	-1	2016-10	1477669973	Yeah dude, who writes or posts to Reddit??
1	Ad hominem, the most effective rebuttal!	SchlangeHatRecht	uspolitics	2	-1	-1	2016-10	1477672022	Coming from a network farther right politically than FOX, yeah not a chance this is accurate.
1	But they are focusing on increasing Canadian incomes and job opportunities... unless you are a cis white male.	SilentLurker666	metacanada	5	-1	-1	2016-10	1477675855	Government meddling in private industry for social engineering purposes. Why doesn't the government focus on increasing Canadians incomes and job opportunities. This is just more of the same crap we've suffered under for 3 decades. Big government has stolen our prosperity. Our leaders are Lords of Economic Stagnation.
0	i dunno, i did the search for all jpg and jpeg's looked for that filename on the page and couldn't find the filename.	oggusfoo	The_Donald	1	-1	-1	2016-11	1478230292	Open IMG_4270-2.JPG
0	They'll pass his wall in exchange for getting everything else they want.	AgoraiosBum	PoliticalDiscussion	7	-1	-1	2016-11	1478028959	No. Even if the alt-right manages to gain congressional seats, they won't have the numbers to push Trump's agenda. The Republicans in congress now will not pass his wall or infrastructure plan as it is
0	Any self respecting person wouldn't let that happen.	WeepingAngelTears	worldnews	0	0	0	2016-09	1475181452	If they were serious, they'd kill all pit bulls *with* owners
0	What are they going to show on ACCN Classic if some fan has uploaded it for free?	RuledbyShmoopie	CFB	2	2	0	2016-09	1473937041	Sad, but not surprising.
0	Petty behaviour begets judgement.	waffle247	skyrim	1	-1	-1	2016-11	1479129805	Who pissed in your cheerios pal? I guess you've got me real figured out from just a couple internet posts huh? Gee I wish I had that talent. Fuck right off with your holier-than-thou bullshit mate. Get a grip lol.
0	A legal argument can definitely be made.	drive_me_away	politics	13	-1	-1	2016-11	1479315309	No they haven't. You can say that all day long but it won't make it so. I can say 2+2=3 all day long but it doesn't make it so.
0	I've heard that very frequently lately, that Veep is how things really work.	fat_osvaldo	politics	1	1	0	2016-09	1474328317	People wish our government was The West Wing, imagine it to be House of Cards but in my mind it's secretly Veep.
0	I'm Muslim so, heres my religious view point, you get questioned in the grave about your deeds, if you're good, you sleep, until the day of resurrection, if you're bad, you're punished in the grave, now, either way, you'll wait till the end of the world, if you're good, you go to heaven, if you're bad and Muslim, you go to hell temporarily.	notafunnyguy32	AskReddit	1	-1	-1	2016-12	1481185483	What are your personal beliefs about what happens to us when we pass away?
0	Two years sounds a bit lenient for stomping an underage teenager's head into the street.	methmobile	worldnews	301	-1	-1	2016-12	1480949386	Damn that article is an infuriating read.
0	Worth noting that for the most part, we're not embracing it because it has anything to do with being associated with blackness--we're embracing it because it's good.	MemoryLapse	canada	2	-1	-1	2016-10	1476427398	Lol. No racism of any kind is good , but it's good to see that white people now embrace black music, dance, medua, athletes, Caribbean food etc...
0	Look, just another Republican Conservative blaming a Democrats FTFY	Pumaplayssd	SRSsucks	0	-1	-1	2016-11	1478789897	Look just another white male racist blaming a black man.
1	See guys all those people begging for likes and retweets are totally justified.	Henchmanx24x	BlackPeopleTwitter	8	-1	-1	2016-11	1478008589	a year later and he got off, s/o to her
0	The gif is in low quality so you can't really tell	unal991	Warthunder	1	-1	-1	2016-10	1477395860	Wow the difference between high and ultra is insane haha
1	No bro you are the only one who does that.	BigWillie54	SquaredCircle	0	-1	-1	2016-11	1478008863	Does anyone else just watch the ppvs now? Ever since the brandsplit, I practically only watch the ppvs now and to be totally honest, I'm quite satisfied with it. The last Raw I watched was when KO won the title and I haven't seen smackdown since the fire smackdown live after the split. I don't know who else does this but it's so much less time consuming and I still feel like I'm getting the jist of the story by being on this sub. I watch some of the highlights people throw on here as well. Does anyone else do this?
0	How does that make more sense?	DiFrence	dataisbeautiful	39	-1	-1	2016-12	1482164988	Someone else pointed out that theyre probably sticking Indians with Asians. It makes a lot more sense when you think of it that way
0	Yeah, I was a little rash in using the word trash.	SmashCity28	AskReddit	2	-1	-1	2016-12	1482278253	I wouldn't say it was trash, but I was definitely glad to have read the book first, because it was one of the most shocking scenes I have ever read. I think it was so great because it was a Catelyn POV chapter, and that was the first time I have ever seen an author kill off a narrator during their story arc. Wasn't expecting it at all.
0	Maybe, but the point is, DBG can't ban someone because of their comments on reddit, hell how does DBG know they are the same guy?	Zeppo80	Planetside	1	-1	-1	2016-12	1482213307	It is certainly reflective of their behavior and attitude, especially since this has been going on for several months.
1	Ah, the benefits of living in a non-secular country!	kalni	worldnews	3	-1	-1	2016-11	1478010586	really don't care
0	I can't say I disagree with any of that.	Augustus_Caesar1	politics	2	-1	-1	2016-10	1477271245	I am using 1% as a pejorative. Trump will be anything that gets trump what he wants. He has no moral code, no set of ethics and is a narcissistic bubble of goo with sausage like fingers.
0	As far as I know, in most cases (at least in our country) you pay for hosting and domain at the same time... and unless you have paid for backup, hosting company wont keep your data and will just delete it.	ManiaCCC	Diablo	1	-1	-1	2016-11	1478011136	Did something happen to the hosting? Fyi, the domain name is just a name assigned to a specific ip address. More than likely the server is fine.
0	Sorry for your loss, hopefully Overwatch can make you feel better.	CoffeeDragon16	Overwatch	1	-1	-1	2016-10	1476221870	Sometimes life throws you curveballs. Set my alarm. Pre downloaded the patch the night before. Woke up. Turned ny computer on, went dow stairs ti feed the 4 week old lorikeet we were hand raising. Passed away. Sometimes Heroes die.
0	His slimy way of getting the woman to hug The Donald was creepy.	Spikekuji	entertainment	10	-1	-1	2016-10	1476577197	I hate when it executives get fired for their own actions and still get a massive payout, but why is Billy Bush getting fired in the first place? I read the entire transcript, he didn't even say anything that was that bad. Just commented on hot women and their legs while off the air. A suspension seems fair. Firing seems excessive considering that in 2006, he was an entertainment TV host, not an anchor of the evening news. This is hypocritical--how many other entertainment TV personalities had made similar comments (even on the air)?
0	Does he know what they do to adulterers in theocracies?	JustGotOffOfTheTrain	politics	12	-1	-1	2016-10	1476902334	Men like Gingrich would see America become a theocracy.
0	My local hospital has a metal detector going into the scan room.	Altephor1	tifu	1	1	0	2016-09	1473906755	you would think if they are so overzealous as to put metal detectors in schools and airports that they could put one in the entrances to MRIs so the alarms would go off before you walked in with metal.
0	That CPU will bottleneck a 390x.	Bengtoo	pcmasterrace	1	-1	-1	2016-11	1480249632	r8 my build (pls no bully)
0	I agree that this guy is a huge douche but if this is enough to make you stop playing for a while then maybe online games aren't for you.	NeedHelpWithExcel	BattleRite	1	-1	-1	2016-10	1475860445	Really enjoy this game, but this makes me stop playing for a while.
0	The game key is the 16 digit number on the front of your credit card	NeedHelpWithExcel	BattleRite	3	-1	-1	2016-10	1475944754	"Hi, can I have a Battlerite ""game key"" ?"
1	You can tell he definitely took his time to make a well thought out post describing his opinions of the current meta though.	Chop_Hard	DestinyTheGame	3	-1	-1	2016-11	1478027310	you're right we needed **another** thread to bitch about the crucible meta.
0	By showing everyone your ID.... twice if you're as stupid as the guy above me	RekSai_Only	DBZDokkanBattle	2	-1	-1	2016-10	1475351065	"^ how do you get ""hacked"" in dokkan battle???"
0	You really made my face light up with a smile because you're so beautiful.	Jakethesnake98	transpassing	2	-1	-1	2016-12	1481788784	19, 1 Year HRT. How am I doin?
0	Khan academy is also a pretty dope resource for LA IIRC	LikeThereNeverWas	OSU	1	1	0	2016-09	1473792405	book marked. THANKS
0	If you live in one of these states, contact your local representatives, attorney generals, and demand that they investigate this.	frombildgewater	The_Donald	6	-1	-1	2016-10	1476898889	Soros voting machines placed in 16 states...
1	So obviously she should be murdered	CrouchingToaster	worldnews	2	-1	-1	2016-11	1478028470	He took his fathers money for a sex change knowing he'd be against it. What a piece of shit.
0	I freaking love the light up boards in Vancouver.	hockeycross	hockey	27	-1	-1	2016-10	1476687411	Brandon Sutter follows up his shootout winner vs Calgary with an OT winner vs Carolina
0	Damn, Wish i was as witty and creative as you.	Flumping	videos	19	-1	-1	2016-12	1482517187	That's what they say about your mother. :)
0	It's not something solar proponents highlight	Count_Spockula	energy	0	-1	-1	2016-12	1481867008	Yeah, but no power source is immune from that.
0	My condolences.	SorteKanin	KingkillerChronicle	12	-1	-1	2016-10	1477070939	Good thing you haven't realized it 4 years ago, Imagine the wait...
0	These jokes are killing me, lmao.	YellowCurryNinja	BleachBraveSouls	1	-1	-1	2016-11	1478104584	Klab must really love Shinji i dont blame them i heard he's nicer than hiyori
0	Ya but the job security	TheRealAntacular	investing	2	-1	-1	2016-12	1481472127	Well, you've got to move beyond custodian I believe.
